ID,English_Text,Khmer_Text
122,"In response, Mr. Till Ahnert, Head of the EU-German GATE project, reiterated his support for the Ministry of Commerce in formulating the national pepper policy/strategy to contribute and promote the export of Cambodian pepper products.",ជាការឆ្លើយតប លោក Till Ahnert ប្រធានគម្រោង EU-German GATE បានបញ្ជាក់ពីជំហរក្នុងការផ្តល់គាំទ្រក្រសួងពាណិជ្ជកម្មលើការរៀបចំឯកសារយុទ្ធសាស្ត្រ ឬគោលនយោបាយនេះ ដើម្បីចូលរួមចំណែកគាំទ្រ និងជំរុញការនាំចេញផលិតផលម្រេចកម្ពុជា។
123,"(Phnom Penh): On the morning of Tuesday, 17 December 2024, at the Ministry of Commerce, His Excellency LIM Lork Piseth, Secretary of State of the Ministry of Commerce, received a courtesy call from Mr. LIANG Songshou, Chairman of the Guangdong-Hong Kong-Macao Greater Bay Area Economic Industry Research Federation and his delegates. The purpose was to strengthen trade and investment relations between Guangdong Province and Cambodia, and to gain a further understanding of Cambodia’s policies and strategies regarding trade, investment, education, energy, and the environment.",(ភ្នំពេញ)៖ នាព្រឹកថ្ងៃអង្គារ ទី១៧ ខែធ្នូ ឆ្នាំ២០២៤ នៅទីស្តីក្រសួងពាណិជ្ជកម្ម ឯកឧត្តម លីម ឡោកពិសិដ្ឋ រដ្ឋលេខាធិការក្រសួងពាណិជ្ជកម្ម បានទទួលជួបពិភាក្សាការងារជាមួយ លោក LIANG Songshou ប្រធានសហព័ន្ធសិក្សាស្រាវជ្រាវសេដ្ឋកិច្ច ឧស្សាហកម្មតំបន់ឆ្នេរក្វាងទុង-ហុងកុង-ម៉ាកាវ និងសហការី ដើម្បីពង្រឹងនូវទំនាក់ទំនងពាណិជ្ជកម្ម និងការវិនិយោគរវាងខេត្តក្វាងទុងជាមួយកម្ពុជា ក៏ដូចជាស្វែងយល់បន្ថែមអំពីគោលនយោបាយដែលពាក់ព័ន្ធនឹងវិស័យពាណិជ្ជកម្ម វិនិយោគ អប់រំ ថាមពល និងបរិស្ថាននៅក្នុងប្រទេសកម្ពុជា។
124,"At the outset, His Excellency Secretary of State, welcomed the Federation’s delegation and expressed appreciation for their interest in learning more about business and investment opportunities in Cambodia. His Excellency Secretary of State, provided an overview of key policies and strategies implemented by the Royal Government of Cambodia, particularly those spearheaded by the Ministry of Commerce, aimed at enhancing commercial activities and attracting more investment from various regions.",បន្ថែមពីនេះ ឯកឧត្តមរដ្ឋលេខាធិការ បានជម្រាបជូនអំពីគោលនយោបាយ និងយុទ្ធសាស្រ្តសំខាន់ៗដែលបានដាក់ចេញដោយរាជរដ្ឋាភិបាលកម្ពុជា ជាពិសេសមានក្រសួងពាណិជ្ជកម្មជាសេនាធិការ ក្នុងការធ្វើឱ្យប្រសើរឡើងនូវការធ្វើពាណិជ្ជកម្ម និងការទាក់ទាញការវិនិយោគបន្ថែមទៀតពីគ្រប់មជ្ឈដ្ឋាន។
125,"His Excellency Secretary of State, also highlighted the long-standing and close ties between Cambodia and China, the establishment of the Cambodia-China bilateral Free Trade Agreement (CCFTA), and other regional and global cooperation initiatives.","ជាមួយគ្នានេះ ឯកឧត្តមរដ្ឋលេខាធិការ ក៏បានលើកឡើងអំពីចំណងមិត្តភាពដ៏ស្អិតរមួត និងយូរអង្វែងរវាងកម្ពុជា-ចិន, ការបង្កើតកិច្ចព្រមព្រៀងពាណិជ្ជកម្មសេរីទ្វេភាគីកម្ពុជា-ចិន និងកិច្ចសហប្រតិបត្តិការផ្សេងៗទៀតទាំងក្នុងតំបន់ និងសកលលោក។"
126,"In response, Mr. LIANG Songshou expressed his sincere thanks to the Ministry of Commerce for the opportunity to pay a courtesy call and hold discussions. Mr. Chairman emphasized that Cambodia has great potential for business and investment. He conveyed his strong interest in investing in Cambodia, particularly in biomass energy and education, and expressed a desire to collaborate with the government on investments in environmental protection.",ជាការឆ្លើយតប លោកប្រធានសហព័ន្ធ បានថ្លែងអំណរគុណដល់ក្រសួងពាណិជ្ជកម្មដែលបានអនុញ្ញាតឱ្យរូបលោក និងគណៈប្រតិភូ បានចូលជួបសម្តែងការគួរសម និងពិភាក្សាការងារ។ លោកប្រធានសហព័ន្ធ បន្តថា កម្ពុជាគឺជាប្រទេសមួយដែលមានសក្តានុពលសម្រាប់ពាណិជ្ជកម្ម និងវិនិយោគ ហើយ លោក ពិតជាមានការចាប់អារម្មណ៍យ៉ាងខ្លាំងក្នុងការមកវិនិយោគនៅកម្ពុជា ជាពិសេសលើវិស័យថាមពលជីវម៉ាសនិងអប់រំ ព្រមទាំងចង់ចូលរួមជាមួយរដ្ឋាភិបាលក្នុងការវិយោគលើវិស័យការពារបរិស្ថាន ផងដែរ។
127,"(Miri, Sarawak, Malaysia): On Sunday, 5 January 2025, Mr. Vith Panhnha, Commercial Attaché, accompanied His Excellency Ouk Chandara, Cambodian Ambassador to Malaysia, in responding to the invitation of His Excellency YB Adam Yii Siew Sang, Mayor of Miri City, Sarawak, Malaysia. This was the second day of their visit to Miri City, Sarawak, Malaysia.","(MIRI, Sarawak, ម៉ាឡេស៊ី)៖ នាថ្ងៃអាទិត្យ ទី៥ ខែមករា ឆ្នាំ២០២៥ តបតាមការអញ្ជើញរបស់ ឯកឧត្តម YB ADAM YII SIEW SANG, អភិបាលក្រុង Miri នៃរដ្ឋ Sarawak ប្រទេសម៉ាឡេស៊ី លោក វ៉ិត បញ្ញា អនុព័ន្ធពាណិជ្ជកម្មអមស្ថានទូតកម្ពុជាប្រចាំប្រទេសម៉ាឡេស៊ី បានបន្តចូលរួមអម ឯកឧត្តម អ៊ុក ចាន់ដារ៉ា ឯកអគ្គរាជទូតកម្ពុជាប្រចាំប្រទេសម៉ាឡេស៊ី ក្នុងការបំពេញទស្សនកិច្ចនាថ្ងៃទី២នៃដំណើរទស្សនកិច្ច នៅទីក្រុង Miri នៃរដ្ឋ Sarawak ប្រទេសម៉ាឡេស៊ី។"
128,The main results of this visit are as follows:,លទ្ធផលសំខាន់ៗនៃការអញ្ជើញបំពេញទស្សនកិច្ចនេះ មានដូចខាងក្រោម៖
129,"- 1, a study visit to Curtin University, Miri, a renowned university with the same academic system as Curtin University, Australia. Graduates receive their degrees from Australia. Curtin University currently has a memorandum of understanding with the Institute of Technology of Cambodia for pre-university or foundation courses, and the university is exploring the possibility of investing in Cambodia's education sector and seeking to sign additional memoranda of understanding with other Cambodian universities.",ទី១ បំពេញទស្សនកិច្ចសិក្សានៅ Curtin University ដែលជាសាកលវិទ្យាល័យដ៏ល្បីមួយនៅក្នុងទីក្រុង MIRI ដែលមានប្រព័ន្ធសិក្សាដូច Curtin University នៅប្រទេសអូស្រ្តាលី ហើយនិស្សិតដែលបានបញ្ចប់ការសិក្សាត្រូវទៅទទួលសញ្ញាប័ត្រនៅប្រទេសអូស្រ្តាលី។ Curtin University បច្ចុប្បន្នបានចុះអនុស្សារណៈនៃការយោគយល់គ្នា ជាមួយវិទ្យាស្ថានបច្ចេកវិទ្យាកម្ពុជាផងដែរក្នុងកម្មវិធី Pre University ឬ Foundation Courses ហើយសាកលវិទ្យាល័យកំពុងសិក្សានិងពិនិត្យលទ្ធភាពក្នុងការវិនិយោគលើវិស័យអប់រំនៅកម្ពុជា និងស្វែងរកការចុះអនុស្សារណៈនៃការយោគយល់គ្នាបន្ថែមជាមួយនឹងសកលវិទ្យាល័យផ្សេងៗទៀតនៅកម្ពុជាផងដែរ។
130,"- 2, a visit to several important Miri locations, including the Handicraft Culture Centre, the Sarawak Unity Bridge (representing the solidarity and unification of Sarawak), public parks and infrastructure, the Petroleum Museum of Sarawak, and observation of the city's overall view and landscape.","-ទី២ បានបំពេញទស្សនកិច្ចសិក្សានៅទីកន្លែងសំខាន់ៗមួយចំនួននៅក្នុងទីក្រុង Miri រួមមានដូចជា Handicraft Culture Center, Sarawak Unity Bridge ដែលជាស្ពានតំណាងអោយការសាមគ្គីនិងការបង្រួបបង្រួមនៃរដ្ឋ Sarawak, សួនសាធារណៈនិងហេដ្ឋារចនាសម្ព័ន្ធនានានៃទីក្រុង Miri, សារមន្ទីរប្រេង នៃរដ្ឋ Sarawak (Petroleum Museum of Sarawak) និងបន្តការទស្សនាទិដ្ឋភាពរួមនិងទេសភាពនៃទីក្រុង MIRI ទាំងមូល។"
131,"(Tokyo, Japan): On the evening of Tuesday, 7 January 2025, Mr. SIN Saray, Commercial Attaché to the Cambodian Embassy in Japan, accompanied His Excellency TUY Ry, Ambassador of Cambodia to Japan, in paying a courtesy call to His Excellency MUTO Yoji, Minister of Economy, Trade and Industry of Japan (METI), Mr. YASUNAGA Tatsuo, Chairman of the Japan Foreign Trade Council, Inc. (JFTC), and Mr. ISHIGURO Norihiko, Chairman of the Japan External Trade Organization(JETRO), on the occasion of joining the JFTC New Year’s Reception, which was held under the chairmanship of His Excellency MUTO Yoji, Minister of Economy, Trade and Industry of Japan at the New Otani Hotel in Tokyo.","(តូក្យូ, ជប៉ុន)៖ នាល្ងាចថ្ងៃអង្គារ ទី០៧ ខែមករា ឆ្នាំ២០២៥ លោក ស៊ីន សារ៉ាយ អនុព័ន្ធពាណិជ្ជកម្មអមស្ថានទូតកម្ពុជាប្រចាំប្រទេសជប៉ុន បានចូលរួមអម ឯកឧត្តម ទុយ រី ឯកអគ្គរាជទូតកម្ពុជាប្រចាំប្រទេសជប៉ុន ជួបសម្តែងការគួរសមជាមួយ ឯកឧត្តម MUTO Yoji រដ្ឋមន្រ្តីក្រសួងសេដ្ឋកិច្ច ពាណិជ្ជកម្ម និងឧស្សាហកម្មជប៉ុន លោក YASUNAGA Tatsuo ប្រធានក្រុមប្រឹក្សាពាណិជ្ជកម្មបរទេសជប៉ុន JFTC និង លោក ISHIGURO Norihiko ប្រធានអង្គការ JETRO នៅក្នុងឱកាសអញ្ជើញចូលរួមកម្មវិធី JFTC New Year’s Reception ដែលប្រព្រឹត្តទៅក្រោមអធិបតីភាព ឯកឧត្តម MUTO Yoji រដ្ឋមន្រ្តីក្រសួងសេដ្ឋកិច្ច ពាណិជ្ជកម្ម និងឧស្សាហកម្មជប៉ុន (METI) នៅសណ្ឋាគារ New Otani ទីក្រុងតូក្យូ។"
132,"Taking this opportunity, the Commercial Attaché also met with Mr. YASUNAGA, Chairman of the JFTC, and Mr. ISHIGURO, Chairman of JETRO, as well as the Presidents and CEOs of several major Japanese investment companies, to establish business relations and encourage more Japanese investors to do business and invest in Cambodia.",ឆ្លៀតក្នុងឱកាសនោះ លោកអនុព័ន្ធពាណិជ្ជកម្ម ក៏បានជួបពិភាក្សាការងារជាមួយ លោក YASUNAGA ប្រធានក្រុមប្រឹក្សាពាណិជ្ជកម្ម JFTC និង លោក ISHIGURO ប្រធានអង្គការ JETRO ព្រមទាំងប្រធានក្រុមហ៊ុនវិនិយោគជប៉ុនធំៗមួយចំនួនទៀតផងដែរ ដើម្បីបង្កើតទំនាក់ទំនងធុរកិច្ច និងជំរុញអ្នកវិនិយោគជប៉ុន ឱ្យទៅធ្វើធុរកិច្ចពាណិជ្ជកម្ម និងវិនិយោគនៅប្រទេសកម្ពុជា កាន់តែច្រើនឡើងថែមទៀត។
133,"(Phnom Penh): On the morning of Thursday, 9 January 2025, at the Ministry of Commerce, His Excellency KEM Sithan, Permanent Secretary of State of the Ministry of Commerce and High Representative of Her Excellency CHAM Nimul, Minister of Commerce, chaired the weekly meeting attended by the Ministry's leaders, director-general, department directors, provincial department directors, and other officials.",(ភ្នំពេញ)៖ នាព្រឹកថ្ងៃព្រហស្បតិ៍ ទី៩ ខែមករា ឆ្នាំ២០២៥ នៅទីស្ដីការក្រសួងពាណិជ្ជកម្ម ឯកឧត្តម កឹម ស៊ីថន រដ្ឋលេខាធិការប្រចាំការក្រសួងពាណិជ្ជកម្ម តំណាងដ៏ខ្ពង់ខ្ពស់របស់ លោកជំទាវ ចម និម្មល រដ្ឋមន្ត្រីក្រសួងពាណិជ្ជកម្ម បានអញ្ជើញដឹកនាំកិច្ចប្រជុំប្រចាំសប្ដាហ៍របស់ក្រសួងពាណិជ្ជកម្ម ដែលមានវត្តមានចូលរួមពី ឯកឧត្តម លោកជំទាវ រដ្ឋលេខាធិការ អនុរដ្ឋលេខាធិការ អគ្គនាយក អគ្គាធិការ លោក-លោកស្រីអគ្គនាយករង អគ្គាធិការរង ប្រធាននាយកដ្ឋាន-វិទ្យាស្ថាន អនុប្រធាននាយកដ្ឋាន-វិទ្យាស្ថាន ប្រធាន និងអនុប្រធានមន្ទីរ ព្រមទាំងសាខា ក.ប.ប. រាជធានី-ខេត្តទាំងអស់ចំណុះឱ្យក្រសួងពាណិជ្ជកម្មផងដែរ។
134,The weekly meeting covered the following agenda items:,កិច្ចប្រជុំប្រចាំសប្ដាហ៍នេះ បានប្រព្រឹត្តទៅក្រោមរបៀបវារៈរួមមាន៖
135,1. Brief report of General Directorate of Administration and Finance,១. របាយការណ៍សង្ខេបរបស់អគ្គនាយកដ្ឋានរដ្ឋបាល និងហិរញ្ញវត្ថុ
136,2. General Directorate of Domestic Trade,២. របាយការណ៍សង្ខេបរបស់អគ្គនាយកដ្ឋានពាណិជ្ជកម្មក្នុងប្រទេស
137,3. General Directorate of International Trade,៣. របាយការណ៍សង្ខេបរបស់អគ្គនាយកដ្ឋានពាណិជ្ជកម្មអន្ដរជាតិ
138,4. General Directorate of Business Services,៤. របាយការណ៍សង្ខេបរបស់អគ្គនាយកដ្ឋានសេវាពាណិជ្ជកម្ម
139,5. General Directorate of Trade Promotion,៥. របាយការណ៍សង្ខេបរបស់អគ្គនាយកដ្ឋានជំរុញពាណិជ្ជកម្ម
140,"6. General Directorate of Consumer Protection, Competition, and Fraud Repression (CCF)",៦. របាយការណ៍សង្ខេបរបស់អគ្គនាយកដ្ឋាន ការពារអ្នកប្រើប្រាស់ កិច្ចការប្រកួតប្រជែង និងបង្រ្កាបការក្លែងបន្លំ (ក.ប.ប.)
141,7. Green Trade Company,៧. របាយការណ៍សង្ខេបរបស់ក្រុមហ៊ុនហ្គ្រីនត្រេដ
142,8. Brief report of the Kandal Provincial Department of Commerce,៨. របាយការណ៍របស់មន្ទីរពាណិជ្ជកម្មខេត្តកណ្តាល
143,9. Brief report of the Phnom Penh Provincial Department of Commerce,៩. របាយការណ៍របស់មន្ទីរពាណិជ្ជកម្មរាជធានីភ្នំពេញ
144,10. Other matters.,១០. បញ្ហាផ្សេងៗ។
145,"(Shenzhen, China): On Friday, 3 January 2025, responding to invitations from Heli-Eastern and Amber Aviation Limited, Mr. Lao Nguon Eng, Commercial Attaché at the Consulate General of Cambodia in Guangzhou, Guangdong Province, People’s Republic of China, visited the two companies to observe their operations. These companies plan to expand their businesses and strengthen cooperation in ASEAN, including Cambodia.","(ស៊ីនជិន, ចិន)៖ នាថ្ងៃសុក្រទី៣ ខែមករា ឆ្នាំ២០២៥ តបតាមការអញ្ជេីញរបស់ក្រុម Heli-Eastern និង Amber Aviation Limited របស់ទីក្រុងស៊ីនជិន លោក ឡៅ ងួន អេង អនុព័ន្ធពាណិជ្ជកម្មកម្ពុជាអមស្ថានអគ្គកុងស៊ុលកម្ពុជាប្រចាំទីក្រុងក្វាងចូវ នៃខេត្តក្វាងទុង សាធារណរដ្ឋប្រជាមានិតចិន បានចុះទស្សនកិច្ចក្នុងក្រុមហ៊ុនទាំងពីរខាងលេី ដេីម្បីសិក្សាស្វែងយល់អំពីប្រតិបត្តិការពាណិជ្ជកម្មរបស់ក្រុមហ៊ុនទាំងពីរខាងលើ។"
146,"Heli-Eastern produces and delivers various types of drones in China, including those used for urban transportation and agriculture. It also provides urban air services in the Greater Bay Area (Guangdong-Hong Kong-Macao Greater Bay Area).",សូមជម្រាបជូនថា ក្រុមហ៊ុន Heli-Eastern ជាក្រុមហ៊ុនផលិត ចែកចាយយន្តហោះ Drove ខ្នាតតូច សម្រាប់បម្រេីដល់វិស័យដឹកជញ្ជូនក្នុងទីក្រុង និងសម្រាប់បម្រេីការងារកសិកម្ម ព្រមទាំងធ្វេីអាជីវកម្មបម្រេីសេវាហោះហេីរយន្តហោះ Helicoper ក្នុងតំបន់ Great Bay Areaម(Guangdong-Hong Kong-Macao Great Bay Area)។ 
147,"Amber Aviation Limited provides aviation services using its private jets to transport passengers within ASEAN and has been strengthening cooperation with ASEAN member states, including Cambodia.",ដោយឡែក ក្រុមហ៊ុន Amber Aviation Limited ជាក្រុមហ៊ុនបម្រេីសេវាហោះហេីរយន្តហោះ Private Jet សម្រាប់ការធ្វេីដំណេីរនៅក្នុងតំបន់អាស៊ាន។
148,Both companies expressed their intention to expand their businesses in Cambodia and strengthen close cooperation with the country.,តាមការបញ្ជាក់ ក្រុមហ៊ុនទាំងពីរខាងលើ បានបង្ហាញបំណងចង់មកធ្វេីពាណិជ្ជកម្មនៅកម្ពុជានាពេលខាងមុខ និងពង្រឹងកិច្ចសហការឱ្យកាន់តែជិតស្និទ្ធជាមួយកម្ពុជាលេីសេវាហោះហេីរឯកជន ផងដែរ។
149,"(Phnom Penh): On the morning of Thursday, January 2025, at the Ministry of Commerce, His Excellency KEM Sithan, Permanent Secretary of State of the Ministry of Commerce and High Representative of Her Excellency CHAM Nimul, Minister of Commerce, chaired the weekly meeting attended by the Ministry's leaders, including the Secretary of State, Under Secretary of State, Director General, Directors of Departments, Directors of Provincial Departments, and other officials.",(ភ្នំពេញ)៖ នាព្រឹកថ្ងៃព្រហស្បតិ៍ ទី២ ខែមករា ឆ្នាំ២០២៥ នៅទីស្ដីការក្រសួងពាណិជ្ជកម្ម ឯកឧត្តម កឹម ស៊ីថន រដ្ឋលេខាធិការប្រចាំការក្រសួងពាណិជ្ជកម្ម តំណាងដ៏ខ្ពង់ខ្ពស់របស់ លោកជំទាវ ចម និម្មល រដ្ឋមន្ត្រីក្រសួងពាណិជ្ជកម្ម បានអញ្ជើញដឹកនាំកិច្ចប្រជុំប្រចាំខែរបស់ក្រសួងពាណិជ្ជកម្ម ដែលមានវត្តមានចូលរួមពី ឯកឧត្តម លោកជំទាវរដ្ឋលេខាធិការ ឯកឧត្តម លោកជំទាវអនុរដ្ឋលេខាធិការ ឯកឧត្តមអគ្គនាយក លោកជំទាវអគ្គាធិការ លោក-លោកស្រីអគ្គនាយករង លោក-លោកស្រីអគ្គាធិការរង លោកប្រធាននាយកដ្ឋាន-វិទ្យាស្ថាន លោក-លោកស្រីអនុប្រធាននាយកដ្ឋាន-វិទ្យាស្ថាន លោក-លោកស្រីប្រធាន និងអនុប្រធានមន្ទីរ និងសាខា ក.ប.ប. រាជធានី-ខេត្តទាំងអស់ចំណុះឱ្យក្រសួងពាណិជ្ជកម្មផងដែរ។
150,"The weekly meeting was held at the Ministry of Commerce and via video conference, covering the following agenda: Brief report on the work direction for implementation in 2025 of the units under the Ministry of Commerce, such as the General Directorate, General Inspectorate, and Green Trade Company as well as discussing Other matters.",កិច្ចប្រជុំប្រចាំសប្ដាហ៍នេះ បានប្រព្រឹត្តទៅក្រោមរបៀបវារៈរួមមាន៖ របាយការណ៍ស្តីពីការកំណត់ទិសដៅការងារសម្រាប់អនុវត្តបន្តក្នុងឆ្នាំ២០២៥ របស់អង្គភាពក្រោមឱវាទក្រសួងពាណិជ្ជកម្ម ដូចជា៖ អគ្គនាយកដ្ឋាន អគ្គាធិការដ្ឋាន និងក្រុមហ៊ុនហ្គ្រីនត្រេដ ព្រមទាំងការពិភាក្សាអំពីបញ្ហាផ្សេងៗ ផងដែរ។
