ID,English_Text,Khmer_Text
100,"(Phnom Penh): On the morning of Thursday, 26 December 2024, at the Ministry of Commerce, His Excellency KEM Sithan, Acting Minister of Commerce and High Representative of Her Excellency CHAM Nimul, Minister of Commerce, chaired the monthly meeting attended by the Ministry's leaders, including the Secretary of State, Under Secretary of State, Director General, Directors of Departments, Directors of Provincial Departments, and other officials.",(ភ្នំពេញ)៖ នាព្រឹកថ្ងៃព្រហស្បតិ៍ ទី ២៦ ខែធ្នូ ឆ្នាំ ២០២៤ នៅទីស្ដីការក្រសួងពាណិជ្ជកម្ម ឯកឧត្តម កឹម ស៊ីថន រដ្ឋមន្ត្រីស្ដីទីក្រសួងពាណិជ្ជកម្ម តំណាងដ៏ខ្ពង់ខ្ពស់របស់ លោកជំទាវ ចម និម្មល រដ្ឋមន្ត្រីក្រសួងពាណិជ្ជកម្ម បានអញ្ជើញដឹកនាំកិច្ចប្រជុំប្រចាំខែរបស់ក្រសួងពាណិជ្ជកម្ម ដែលមានវត្តមានចូលរួមពី ឯកឧត្តម លោកជំទាវរដ្ឋលេខាធិការ ឯកឧត្តម លោកជំទាវអនុរដ្ឋលេខាធិការ ឯកឧត្តមអគ្គនាយក លោកជំទាវអគ្គាធិការ លោក-លោកស្រីអគ្គនាយករង លោក-លោកស្រីអគ្គាធិការរង លោកប្រធាននាយកដ្ឋាន-វិទ្យាស្ថាន លោក-លោកស្រីអនុប្រធាននាយកដ្ឋាន-វិទ្យាស្ថាន លោក-លោកស្រីប្រធាន និងអនុប្រធានមន្ទីរ និងសាខា ក.ប.ប. រាជធានី-ខេត្តទាំងអស់ចំណុះឱ្យក្រសួងពាណិជ្ជកម្មផងដែរ។
101,"The monthly meeting was held at the Ministry of Commerce and via video conference, covering the following agenda:",កិច្ចប្រជុំប្រចាំខែនេះ បានប្រព្រឹត្តទៅក្រោមរបៀបវារៈរួមមាន៖
102,1. A brief report on the evaluation of the working results of the Committee for the Ministry of Commerce's Annual Report 2024 and the Ministry's working directions for 2025.,១. របាយការណ៍ស្ដីពីការវាយតម្លៃលទ្ធផលការងាររបស់គណៈកម្មាធិការរៀបចំដំណើរការសន្និបាតបូកសរុបការងារពាណិជ្ជកម្មឆ្នាំ ២០២៤ និងទិសដៅការងារពាណិជ្ជកម្មឆ្នាំ ២០២៥
103,2. A brief report on the preparation of the report format for the Capital Provincial Department of Commerce.,២. របាយការណ៍ស្តីពីការរៀបចំគំរូរបាយការណ៍របស់មន្ទីរពាណិជ្ជកម្មរាជធានី-ខេត្ត
104,3. A brief report on the preparation of the report format for the Commercial Attaché.,៣. របាយការណ៍ស្តីពីការរៀបចំគំរូរបាយការណ៍របស់តំណាងពាណិជ្ជកម្មប្រចាំនៅក្រៅប្រទេស
105,4. A brief report on human resource management for contract officials at the Ministry of Commerce for 2025.,៤. របាយការណ៍ស្តីពីវឌ្ឍនភាពការរៀបចំឯកសារសម្រាប់ដំឡើងថ្នាក់ និងឋានន្តរស័ក្តិ ជូនមន្ត្រីរាជការស៊ីវិលសម្រាប់ឆ្នាំ ២០២៥
106,5. A brief report on the evaluation of the working results of the Committee for the Ministry of Commerce's Annual Report 2024 and its working directions for 2025.,៥. របាយការណ៍ស្តីពីការគ្រប់គ្រង និងការប្រើប្រាស់មន្ត្រីជាប់កិច្ចសន្យារបស់ក្រសួងពាណិជ្ជកម្មសម្រាប់ឆ្នាំ ២០២៥
107,"6. A brief report on the preparation of the Ministry of Commerce's Annual Report 2024 (12 months) by the General Directorate, General Inspectorate, and Green Trade Company.",៦. របាយការណ៍ស្តីពីការត្រៀមរៀបចំបច្ចុប្បន្នភាពរបាយការណ៍ប្រចាំឆ្នាំ (សរុប ១២ ខែ) របស់អគ្គនាយកដ្ឋានអគ្គាធិការដ្ឋាន និងក្រុមហ៊ុនហ្គ្រីនត្រេដ
108,7. Other matters.,៧. បញ្ហាផ្សេងៗ។
109,"(Tokyo, Japan): On the afternoon of Tuesday, December 24, 2024, Mr. SIN Saray, Commercial Attaché to the Cambodian Embassy in Japan, accompanied His Excellency TUY Ry, Ambassador of Cambodia to Japan, in receiving a courtesy call from representatives of the ASEAN-Japan Centre, to discussed preparations for the Cambodia Foods Show, scheduled to be held at the Royal Embassy of Cambodia on February 21, 2025. The event aims to promote Khmer cuisine and potential Cambodian products, as well as to advance Cambodian culinary diplomacy and the import and export activities of Cambodian goods under the economic diplomacy strategy.","(តូក្យូ, ជប៉ុន)៖ នារសៀលថ្ងៃអង្គារ ទី២៤ ខែធ្នូ ឆ្នាំ២០២៤ លោក ស៊ីន សារ៉ាយ អនុព័ន្ធពាណិជ្ជកម្មអមស្ថានទូតកម្ពុជាប្រចាំប្រទេសជប៉ុន បានចូលរួមអម ឯកឧត្តម ទុយ រី ឯកអគ្គរាជទូតកម្ពុជាប្រចាំប្រទេសជប៉ុន ដើម្បីជួបពិភាក្សាការងារជាមួយតំណាងមជ្ឈមណ្ឌលអាស៊ាន-ជប៉ុន (ASEAN-Japan Centre) អំពីការត្រៀមលក្ខណៈក្នុងការរៀបចំតាំងបង្ហាញម្ហូបអាហារខ្មែរ (Cambodia Foods Show) ដែលគ្រោងនឹងធ្វើឡើងនៅស្ថានទូតកម្ពុជា ប្រចាំប្រទេសជប៉ុន នៅថ្ងៃទី២១ ខែកុម្ភៈ ឆ្នាំ២០២៥ ខាងមុខនេះ ក្នុងគោលបំណងផ្សព្វផ្សាយអំពីម្ហូបអាហារខ្មែរ និងផលិតផលសក្តានុពលខ្មែរ ព្រមទាំងជំរុញការទូតម្ហូបអាហារខ្មែរ និងសកម្មភាពនាំចេញនាំចូលផលិតផលខ្មែរ ក្រោមយុទ្ធសាស្រ្តការទូតសេដ្ឋកិច្ច។"
110,"This showcase will feature cooking demonstrations by Cambodian chefs, cultural performances, displays of Cambodian products, and presentations on Cambodian cuisine and tourism potential. Notably, there will be a Food Tasting Networking session, which serves as an important platform for establishing business relationships between participating companies and Japanese travel agents. It will also provide an opportunity to encourage more Japanese investors and tourists to visit Cambodia.",កម្មវិធីតាំងបង្ហាញនេះ នឹងមានរៀបចំការសម្ដែងការចម្អិនម្ហូបអាហារដោយចុងភៅខ្មែរមកពីប្រទេសកម្ពុជា ការសម្ដែងសិល្បៈរបាំ ការតាំងបង្ហាញផលិតផលខ្មែរ ការធ្វើបទបង្ហាញអំពីម្ហូបអាហារ និងសក្តានុពលទេសចរណ៍កម្ពុជា ជាពិសេសកម្មវិធី Food Tasting & Networking ដែលជាវេទិកាដ៏សំខាន់មួយ ក្នុងការបង្កើតឱ្យមានទំនាក់ទំនងធុរកិច្ចរវាងបណ្តាក្រុមហ៊ុនអ្នកចូលរួម និងភ្នាក់ងារទេសចរណ៍ជប៉ុន ក៏ដូចជាឱកាសមួយក្នុងការជំរុញអ្នកវិនិយោគជប៉ុន និងទេសចរជប៉ុនទៅកាន់ប្រទេសកម្ពុជា ឱ្យកាន់តែកើនឡើងថែមទៀតផងដែរ។
111,"(Phnom Penh): On the morning of Monday, 16 December 2024, at the PH Grand Hall Center, Borey Peng Huoth Boeung Snor, Her Excellency TEKRETH Kamrang, Secretary of State of the Ministry of Commerce, delivered the keynote address at the Spotlight on Cambodia's Export Sector Forum. This side event of the Cambodia Trade Expo brought together senior leaders from the Ministry of Commerce, representatives from key ministries and institutions—including the Ministry of Industry, Science, Technology and Innovation; Ministry of Agriculture, Forestry, and Fisheries; Ministry of Posts and Telecommunications; Ministry of Public Works and Transport; National Bank of Cambodia; General Department of Customs and Excise of Cambodia; and Sihanoukville Autonomous Port—alongside development partners, federations, associations, international companies, and local businesses.",(ភ្នំពេញ)៖ នាព្រឹកថ្ងៃចន្ទ ទី១៦ ខែធ្នូ ឆ្នាំ២០២៤ នៅសាលសន្និបាត ហ្រ្គេនហល បុរីប៉េងហួត បឹងស្នោ លោកជំទាវ តឹករ៉េត កំរង រដ្ឋលេខាធិការក្រសួងពាណិជ្ជកម្ម បានអញ្ជើញចូលរួមថ្លែងសុន្ទកថាក្នុងវេទិកាស្តីពីវិស័យនាំចេញកម្ពុជា ដែលជាព្រឹត្តិការណ៍អមមួយនៃពិព័រណ៌ពាណិជ្ជកម្មកម្ពុជា ដោយមានការអញ្ជើញចូលរួមពីថ្នាក់ដឹកនាំក្រសួងពាណិជ្ជកម្ម និងក្រសួង-ស្ថាប័នពាក់ព័ន្ធ រួមមាន៖ ក្រសួងឧស្សាហកម្ម វិទ្យាសាស្ត្រ បច្ចេកវិទ្យា និងនាវានុវត្តន៍ ក្រសួងកសិកម្ម រុក្ខាប្រមាញ់ និងនេសាទ ក្រសួងប្រៃសណីយ៍និងទូរគមនាគមន៍ ក្រសួងសាធារណការ និងដឹកជញ្ជូន ធនាគារជាតិនៃកម្ពុជា អគ្គនាយកដ្ឋានគយនិងរដ្ឋាករកម្ពុជា និងកំពង់ផែស្វយ័តក្រុងព្រះសីហនុ ដៃគូអភិវឌ្ឍន៍ សហព័ន្ធ និងសមាគម ក្រុមហ៊ុនជាតិ-អន្តរជាតិ ជាច្រើនរូប។
112,"The Spotlight on Cambodia's Export Sector Forum was organized by the Export Promotion Task Force to promote Cambodian products in international markets, explore emerging export opportunities, and strengthen Cambodia’s position in global trade. The forum provided a platform for participants to gain valuable insights into international trade trends, network with national and international partners, and foster collaborations to advance the export of Cambodian products. The discussions also focused on identifying new opportunities for processing agricultural products and enhancing value addition to boost export competitiveness.",វេទិកានេះ រៀបចំឡើងដោយក្រុមការងារជំរុញការនាំចេញ ក្នុងគោលបំណងលើកកម្ពស់ការនាំចេញផលិតផលកម្ពុជា ទៅកាន់ទីផ្សារអន្តរជាតិ ដោយផ្តោតសំខាន់លើចក្ខុវិស័យថ្មីៗនៃការនាំចេញ ការអភិវឌ្ឍន៍នៃវិស័យពាណិជ្ជកម្មអន្តរជាតិរបស់កម្ពុជា ក៏ដូចជាផ្តល់ឱកាសដល់អ្នកចូលរួមឱ្យទទួលបានចំណេះដឹង និងផ្សាភ្ជាប់ទំនាក់ទំនងជាមួយដៃគូជាតិ-អន្តរជាតិ ដើម្បីបង្កើតកិច្ចសហប្រតិបត្តិការ និងលើកស្ទួយផលិតផលកម្ពុជានៅលើទីផ្សារសកល ក៏ដូចជាស្វែងរកឱកាសថ្មីៗក្នុងការកែច្នៃផលិតផលកសិកម្ម និងបន្ថែមគុណតម្លៃសម្រាប់ការនាំចេញ។
113,"(Phnom Penh): On the morning of Thursday, 12 December 2024 at the Ministry of Commerce, His Excellency VAR Rothsan, secretary of state of Ministry of Commerce, received a courtesy call from representatives of Cambodia Honey Association and Catalyste+ mainly responsible for promoting and strengthening all stakeholders in the honey value chain, including with beekeepers, wild bee harvesting communities, bee conservation organization and the forest ecology in the Cambodia.",(ភ្នំពេញ)៖ នាព្រឹកថ្ងៃព្រហស្បហតិ៍ ទី១២ ខែធ្នូ ឆ្នាំ២០២៤ នៅទីស្តីការក្រសួងពាណិជ្ជកម្ម ឯកឧត្តម វ៉ា រុតសាន រដ្ឋលេខាធិការក្រសួងពាណិជ្ជកម្ម បានទទួលជួបសម្តែងការគួរសម និងពិភាក្សាការងារជាមួយសមាគមទឹកឃ្មុំកម្ពុជា និងអង្គការ Catalyste+ ដែលមានកាតព្វកិច្ចចម្បងក្នុងការជំរុញ និងពង្រឹងគ្រប់ភាគីពាក់ព័ន្ធក្នុងខ្សែច្រវាក់វិស័យផលិតផលទឹកឃ្មុំ រួមមានអ្នកចិញ្ចឹមឃ្មុំ សហគមប្រមូលផលឃ្មុំព្រៃ អង្គការអភិរក្សឃ្មុំ និងអភិរក្សប្រព័ន្ធអេកូឡូស៊ីព្រៃឈើនៅកម្ពុជា។
114,"On that occasion, the representatives of the Cambodia Honey Association and Catalyste+ informed about the purpose of establishing the Honey Association as well as supporting the activities of Catalyste+ through bee experts as well as seeking support and cooperation for the development of beekeeping sector in Cambodia.",ក្នុងឱកាសនោះ ភាគីតំណាងសមាគមទឹកឃ្មុំកម្ពុជា និងអង្គការ Catalyste+ ជម្រាបជូនអំពីគោលបំណងនៃការបង្កើតសមាគមទឹកឃ្មុំ ព្រមជាមួយនឹងការគាំទ្រសកម្មភាពរបស់អង្គការ Catalyste+ តាមរយៈអ្នកជំនាញឃ្មុំ ក៏ដូចជាស្វែងរកការគាំទ្រ និងកិច្ចសហការ ដើម្បីការអភិវឌ្ឍន៍វិស័យឃ្មុំនៅកម្ពុជា។
115,"As a result, His Excellency chair recommended to the Honey Association to develop a strategy on the Cambodia’s Bee Sector to serve as the roadmap to move toward Economic of scale and increase the Cambodia’s Honey reputation and increase people awareness of using honey in therapeutic functions and strengthen the immune system.",ជាលទ្ធផល ឯកឧត្តមគណៈអធិបតី បានផ្តល់អនុសាសន៍ជូនសមាគមទឹកឃ្មុំ ក្នុងការរៀបចំយុទ្ធសាស្រ្តលើវិស័យឃ្មុំនៅកម្ពុជា ដើម្បីដើរតួនាទីជាផែនទីចង្អុលទិសសម្រាប់វិស័យនេះបោះជំហានទៅរកការផលិតជាមាត្រាសាស្រ្ត និងលើកកម្ពស់ទំនុកចិត្តមកលើការកេរ្តិ៍ឈ្មោះរបស់ទឹកឃ្មុំកម្ពុជា និងបង្កើនការយល់ដឹងរបស់ប្រជាពលរដ្ឋអំពីផលប្រយោជន៍នៃការប្រើប្រាស់ទឹកឃ្មុំក្នុងមុខងារព្យាបាលជំងឺ និងជួយពង្រឹងប្រព័ន្ធភាពស៊ាំក្នុងរាងកាយ។
116,"(Kuala Lumpur, Malaysia): On the afternoon of Tuesday, 17 December 2024, at the Senate House in Kuala Lumpur, Malaysia, Mr. VITH Panhnha, Commercial Attaché, accompanied His Excellency OUK Chandara, Ambassador of Cambodia to Malaysia, and Malaysian investors from Sarawak and Sabah, to a working lunch with HON. Senator Dato Awang Bemee bin Awang Ali Basah, Malaysian Senate President.","(គូឡាឡាំពួរ, ម៉ាឡេស៊ី)៖ នារសៀលថ្ងៃអង្គារ ទី១៧ ខែធ្នូ ឆ្នាំ២០២៤ នៅវិមានព្រឹទ្ធសភា ទីក្រុងគូឡាឡាំពួរ ប្រទេសម៉ាឡេស៊ី លោក វ៉ិត បញ្ញា អនុព័ន្ធពាណិជ្ជកម្ម អមស្ថានទូតកម្ពុជាប្រចាំប្រទេសម៉ាឡេស៊ី បានចូលរួមអម ឯកឧត្តម អ៊ុក ចាន់ដារ៉ា ឯកអគ្គរាជទូតកម្ពុជាប្រចាំប្រទេសម៉ាឡេស៊ី រួមជាមួយវិនិយោគគិនម៉ាឡេស៊ីមកពីរដ្ឋ Sarawak និងរដ្ឋ Sabah ចូលរួមទទួលទានអាហារការងារថ្ងៃត្រង់ជាមួយ ឯកឧត្តម HON. Senator Dato Awang Bemee Bin Awang Ali Basah ប្រធានព្រឹទ្ធសភាម៉ាឡេស៊ី ។"
117,"During the meeting, the Senate President expressed support for investment in Cambodia's rice milling sector and the launch of direct flights from Sarawak to Phnom Penh.",ក្នុងឱកាសនោះ ឯកឧត្តមប្រធានព្រឹទ្ធសភា បានបង្ហាញពីការគាំទ្រចំពោះការវិនិយោគលើវិស័យម៉ាស៊ីនកិនស្រូវនៅកម្ពុជា និងការបើកជើងហោះហើរផ្ទាល់ពីរដ្ឋ Sarawak មកកាន់រាជធានីភ្នំពេញ។
118,"He Excellency Senate President also encouraged Malaysian investors to explore increased investment in Cambodia's trade, agro-industry, energy, education, health, and tourism sectors, and to explore opportunities to enhance closer relations between cities in Sarawak and Sabah and cities or provinces in Cambodia to increase economic volume, investment, trade, tourism, cultural exchange, and educational collaboration.",ជាមួយគ្នានេះ ឯកឧត្តមប្រធានព្រឹទ្ធសភា បានជំរុញវិនិយោគិនម៉ាឡេស៊ី ពិនិត្យលទ្ធភាពក្នុងការបង្កើនការវិនិយោគនៅកម្ពុជាលើវិស័យពាណិជ្ជកម្ម កសិ-ឧស្សាហកម្ម ថាមពល អប់រំ សុខាភិបាល និងទេសចរណ៍ ព្រមទាំងមានបំណងចង់ឱ្យមានកិច្ចសហប្រតិបត្តិការឱ្យកាន់តែជិតស្និតរវាងទីក្រុងណាមួយនៃរដ្ឋ Sarawak និង Sabah របស់ប្រទេសម៉ាឡេស៊ី ជាមួយទីក្រុងនិងខេត្តណាមួយរបស់ប្រទេសកម្ពុជា ដើម្បីបង្កើនទំហំសេដ្ឋកិច្ច ពាណិជ្ជកម្ម ការវិនិយោគ ទេសចរណ៍ វប្បធម៌ និងអប់រំ ផងដែរ។
119,"In response, His Excellency Ambassador expressed his deep gratitude to His Excellency Senate President for hosting the working lunch and welcomed Malaysian investors from Sarawak and Sabah to explore investment opportunities in Cambodia.",ជាកិច្ចឆ្លើយតប ឯកឧត្តមឯកអគ្គរាជទូត បានថ្លែងអំណរគុណយ៉ាងជ្រាវជ្រៅចំពោះ ឯកឧត្តមប្រធានព្រឹទ្ធសភា សម្រាប់ការទទួលស្វាគមន៍នៃការទទួលទានអាហារការងារថ្ងៃត្រង់ដ៏មានសារៈសំខាន់នេះ និងស្វាគមន៍វិនិយោគគិនម៉ាឡេស៊ីទាំងអស់ ក្នុងការពិនិត្យសិក្សានិងស្វែងរកកាលានុវត្តភាពដើម្បីវិនិយោគនៅកម្ពុជានាពេលខាងមុខ។
120,"(Phnom Penh): On the morning of Tuesday, 17 December 2024, at the Ministry of Commerce, His Excellency VA Rothsan, Secretary of State of the Ministry of Commerce, received a courtesy call from representatives of the EU-German GATE project and the EU-German CAPSAFE project to discuss the preparation of a national pepper policy/strategy.",(ភ្នំពេញ)៖ នាព្រឹកថ្ងៃអង្គារ ទី១៧ ខែធ្នូ ឆ្នាំ២០២៤ នៅទីស្តីការក្រសួងពាណិជ្ជកម្ម ឯកឧត្តម វ៉ា រុតសាន រដ្ឋលេខាធិការក្រសួងពាណិជ្ជកម្ម បានទទួលជួបពិភាក្សាការងារលើកទី១ ជាមួយតំណាងគម្រោង EU-German GATE និង EU-German CAPSAFE ដើម្បីពិភាក្សាលើការត្រៀមរៀបចំឯកសារយុទ្ធសាស្ត្រ ឬគោលនយោបាយម្រេចកម្ពុជា។
121,"During the meeting, His Excellency Secretary of State, expressed his gratitude and appreciation to the EU-German GATE project and the EU-German CAPSAFE project for their contribution to the development of the trade sector and highlighted the Ministry of Commerce’s strong commitment in its close cooperation to promote the development of Cambodia’s pepper sector.",ក្នុងនៅកិច្ចប្រជុំនេះ ឯកឧត្តមរដ្ឋលេខាធិការ បានថ្លែងអំណរគុណដល់គម្រោង EU-German GATE និង EU-German CAPSAFE ដែលបានរួមចំណែកដល់ការអភិវឌ្ឍវិស័យពាណិជ្ជកម្មកន្លងមក និងបានលើកពីជំហរយ៉ាងមុតមាំរបស់ក្រសួងពាណិជ្ជកម្មក្នុងការបន្តកិច្ចសហប្រតិបត្តិការយ៉ាងជិតស្និត សំដៅជំរុញ និងអភិវឌ្ឍនវិស័យម្រេចនៅកម្ពុជា។
