ID,English_Text,Khmer_Text
151,"(Phnom Penh): On the morning of Monday, 27 December 2024, at the Ministry of Commerce, His Excellency OK Boung, Secretary of State of the Ministry of Commerce, presided over the ceremony awarding certificates of completion for the Rules of Origin and Export Procedures training (Batch 2) to 39 participants (16 female).",(ភ្នំពេញ)៖ ព្រឹកថ្ងៃសុក្រ ទី២៧ ខែធ្នូ ឆ្នាំ២០២៤ នៅទីស្តីការក្រសួងពាណិជ្ជកម្ម ឯកឧត្តម ឱក ប៊ុង រដ្ឋលេខាធិការក្រសួងពាណិជ្ជកម្ម បានអញ្ជើញជាអធិបតីក្នុងពិធីប្រគល់វិញ្ញាបនបត្របញ្ជាក់ការសិក្សាវគ្គបណ្តុះបណ្តាលស្តីពីវិធានដើមកំណើតទំនិញ និងនីតិវិធីនៃការនាំចេញ (លើកទី២) ជូនសិក្ខាកាមដែលបានប្រលងជាប់ជាស្ថាពរសរុបចំនួន ៣៩រូប (ស្រី ១៦រូប)។
152,"On that occasion, His Excellency Secretary of State stated that this training course aimed to increase knowledge of rules of origin to qualify for preferential tariffs under various free trade agreements and instructions for applying for a certificate of origin through the Ministry of Commerce's automated system.",ក្នុងឱកាសនោះ ឯកឧត្តមរដ្ឋលេខាធិការ បានថ្លែងអំពីគោលបំណងនៃវគ្គបណ្តុះបណ្តាលនេះ ក្នុងការបង្កើនចំណេះដឹងផ្នែកវិធានដើមកំណើតទំនិញដើម្បីទទួលបានភាពអនុគ្រោះក្រោមកិច្ចព្រមព្រៀងសេរីនានា ព្រមទាំងនីតិវិធីក្នុងការស្នើសុំ និងអនុញ្ញាតនូវវិញ្ញាបនបត្របញ្ជាក់ដើមកំណើតទំនិញតាមប្រព័ន្ធស្វ័យប្រវត្តិកម្ម ជូនមន្រ្តីក្រសួងពាណិជ្ជកម្មដែលមានឱកាសក្នុងការបំពេញការងារជាតំណាងពាណិជ្ជកម្មប្រចាំតំបន់សេដ្ឋកិច្ចពិសេសនាថ្ងៃអនាគត។
153,"His Excellency the Secretary of State stated that the training course ran from 25 November 2024 to 9 December 2024, with a curriculum that included both theoretical and practical studies. The theoretical study included lessons on rules of origin, export procedures, and instructions on requesting and authorizing certificates of origin through an automated application. The practical study required all participants to complete a one-week internship.",ឯកឧត្តមរដ្ឋលេខាធិការ បញ្ជាក់ថា វគ្គបណ្តុះបណ្តាលនេះបានចាប់ផ្តើមកាលពីថ្ងៃទី២៥ ខែវិច្ឆិកា ឆ្នាំ២០២៤ ដល់ថ្ងៃទី៩ ខែធ្នូ ឆ្នាំ ២០២៤ ដែលមានកម្មវិធីសិក្សាធ្វើឡើងទាំងទ្រឹស្តី និងការអនុវត្តជាក់ស្តែង ដោយការសិក្សាទ្រីស្តីមានមេរៀនវិធានដើមកំណើតទំនិញ នីតិវិធីនៃការនាំចេញ ការណែនាំពីការស្នើសុំនិងអនុញ្ញាតវិញ្ញបនបត្របញ្ជាក់ដើមកំណើតទំនិញតាមប្រព័ន្ធស្វ័យប្រវត្តិកម្ម ដោយឡែកការចុះអនុវត្តជាក់ស្តែងតម្រូវឱ្យសិក្ខាកាមទាំងអស់ការចុះកម្មសិក្សាដោយផ្ទាល់រយៈពេល ១សប្តាហ៍ផងដែរ៕
154,"(Phnom Penh): On the afternoon of Wednesday, 25 December 2024 at Phnom Penh Hotel, His Excellency HO Sivyong, Delegate of the Royal Government in charge as Director General of Trade Support Services of the Ministry of Commerce, was invited to do a presentation on bilateral trade preferences between Vietnam and Cambodia at the Vietnam-Cambodia Trade and Investment Promotion Forum on Enhancing Cross-Border E-Commerce Cooperation and Digital Economy, organized under the collaboration of the Ministry of Industry and Trade of Vietnam, Vietnam Trade Office in Cambodia and the Vietnam-Cambodia Business Association.","(ភ្នំពេញ)៖ នារសៀលថ្ងៃពុធ ទី២៥ ខែធ្នូ ឆ្នាំ២០២៤ នៅសណ្ឋាគារភ្នំពេញ ឯកឧត្តម ហូ ស៊ីវយ៉ុង ប្រតិភូរាជរដ្ឋាភិបាលទទួលបន្ទុកជាអគ្គនាយកសេវាពាណិជ្ជកម្ម នៃក្រសួងពាណិជ្ជកម្ម បានអញ្ជើញចូលរួមធ្វើបទបង្ហាញស្ដីពីការអនុគ្រោះពាណិជ្ជកម្មទ្វេភាគីរវាងរៀតណាម និងកម្ពុជា នៅវេទិកាជំរុញពាណិជ្ជកម្ម និងវិនិយោគវៀតណាម-កម្ពុជា បង្កើនកិច្ចសហប្រតិបត្តិការពាណិជ្ជកម្មអេឡិចត្រូនិចឆ្លងដែន និងសេដ្ឋកិច្ចឌីជីថល ដែលបានរៀបចំឡើង ក្រោមកិច្ចសហការរវាងក្រសួងឧស្សាហកម្ម និងពាណិជ្ជកម្មវៀតណាម, ការិយាល័យពាណិជ្ជកម្មវៀតណាមប្រចាំកម្ពុជា និងសមាគមសហព័ន្ធធុរកិច្ចវៀតណាម-កម្ពុជា។"
155,"The forum was organized with the aim of facilitating Cambodian and Vietnamese investors and businessmen to establish contacts and networks, as well as to discuss, explore and exchange important information related to the potential and opportunities of business and investment in Cambodia, especially related to cross-border trade cooperation and the digital economy.",វេទិកានេះត្រូវបានរៀបចំឡើងក្នុងគោលបំណងបង្កលក្ខណៈងាយស្រួលសម្រាប់វិនិយោគិន និងធុរជនកម្ពុជា និងវៀតណាមក្នុងការបង្កើតទំនាក់ទំនង និងបណ្តាញ ព្រមទាំងពិភាក្សាស្វែងយល់ និងផ្លាស់ប្តូរនូវព័ត៌មានសំខាន់ៗពាក់ព័ន្ធនឹងសក្តានុពល និងកាលានុវត្តភាពធុរកិច្ច និងវិនិយោគនៅប្រទេសកម្ពុជា ពិសេសពាក់ព័ន្ធកិច្ចសហប្រតិបត្តិការពាណិជ្ជកម្មឆ្លងដែន និងសេដ្ឋកិច្ចឌីជីថល។
156,"Through the above presentation, His Excellency highlighted the potential and opportunities of doing businesses in Cambodia as well as the trade cooperation between Cambodia and Vietnam in the ASEAN framework and especially in the bilateral framework between the two countries.",តាមរយៈបទបង្ហាញខាងលើ ឯកឧត្តមប្រតិភូបានបញ្ជាក់អំពីសក្តានុពល និងកាលានុវត្តភាពធុរកិច្ចនៃប្រទេសកម្ពុជា ព្រមទាំងកិច្ចសហប្រតិបត្តិការផ្នែកពាណិជ្ជកម្មរវាងប្រទេសកម្ពុជា និងប្រទេសវៀតណាម ក្នុងក្របខណ្ឌអាស៊ាន និងជាពិសេសក្នុងក្របខណ្ឌទ្វេភាគីរវាងប្រទេសទាំងពីរផងដែរ។
157,"(Phnom Penh): On the morning of Wednesday, 25 December 2024, at the Office of the Council of Ministers, Her Excellency TAN Tepikanika, Under Secretary of State of the Ministry of Commerce, attended a meeting for the final review of draft laws chaired by His Excellency VONGSEY Vissoth, Permanent Deputy Prime Minister in charge of the Office of the Council of Ministers, and His Excellency KOEUT Rith, Deputy Prime Minister and Minister of Justice.",(ភ្នំពេញ)៖ នៅព្រឹកថ្ងៃពុធ ទី ២៥ ខែធ្នូ ឆ្នាំ ២០២៤ នៅទីស្ដីការគណៈរដ្ឋមន្រ្តី លោកជំទាវ តាន់ ទេពីកណ្ណិកា អនុរដ្ឋលេខាធិការក្រសួងពាណិជ្ជកម្ម បានអញ្ជើញចូលរួមកិច្ចប្រជុំត្រួតពិនិត្យសេចក្តីព្រាងច្បាប់ចុងក្រោយ ដែលមានអធិបតីភាពដោយ ឯកឧត្តម វង្សី វិស្សុត ឧបនាយករដ្ឋមន្រ្តី ប្រចាំការរដ្ឋមន្រ្តីទទួលបន្ទុកទីស្ដីការគណៈរដ្ឋមន្រ្តី និង ឯកឧត្តម កើត រិទ្ធ ឧបនាយករដ្ឋមន្ត្រី និងរដ្ឋមន្ត្រីក្រសួងយុត្តិធម៌។
158,"The meeting was attended by Excellencies, Ladies and Gentlemen, as well as technical experts from various relevant ministries and institutions to review and discuss two draft laws: (1) The draft law on combating the non-recognition of crimes committed during the period of Democratic Kampuchea and (2) The draft law on the temporary disposal of seized goods.",កិច្ចប្រជុំនេះ មានការអញ្ជើញចូលរួមពីសំណាក់ ឯកឧត្តម លោកជំទាវ លោក និងលោកស្រី ដែលជាថ្នាក់ដឹកនាំ និងមន្រ្តីបច្ចេកទេសពីក្រសួង និងស្ថាប័នពាក់ព័ន្ធ ដើម្បីពិនិត្យ ពិភាក្សា និងកែសម្រួលលើសេចក្ដីព្រាងច្បាប់ចំនួនពីរ គឺ៖ (១) សេចក្ដីព្រាងច្បាប់ស្តីពីការប្រឆាំងការមិនទទួលស្គាល់ឧក្រិដ្ឋកម្មដែលប្រព្រឹត្តឡើងក្នុងរយៈកាលនៃកម្ពុជាប្រជាធិបតេយ្យ និង (២) សេចក្ដីព្រាងច្បាប់ស្តីពីការចាត់ចែងជាបណ្ដោះអាសន្ននូវវត្ថុចាប់យក។
159,"(Phnom Penh): On the afternoon of Sunday, 15 December 2024, at the PH Grand Hall, His Excellency SAMHENG Bora, Secretary of State of Ministry of Commerce, high representative of Her Excellency CHAM Nimul, Minister of Commerce presided over a speech at a business matching event under the theme ""Development of Cambodia's Potential Product Market"", an accompanying event during the ""Cambodia Trade Expo"" from 13-16 December 2024.",(ភ្នំពេញ)៖ នារសៀលថ្ងៃអាទិត្យ ទី១៥ ខែធ្នូ ឆ្នាំ២០២៤ នៅសាលសន្និសីទភីអេចហ្ក្រេនហល បុរីប៉េងហួតបឹងស្នោ ឯកឧត្តម សំហេង បូរ៉ា រដ្ឋលេខាធិការ ក្រសួងពាណិជ្ជកម្ម បានអញ្ជើញចូលរួមជាអធិបតីថ្លែងសុន្ទរកថាក្នុងជំនួបពាណិជ្ជកម្ម ស្តីពី “ការអភិវឌ្ឍទីផ្សារផលិតផលសក្តានុពលកម្ពុជា” ដែលជាព្រឹត្តិការណ៍អមក្នុងកំឡុង “ពិព័រណ៍ពាណិជ្ជកម្មកម្ពុជា” ដែលប្រព្រឹត្តទៅចាប់ពីថ្ងៃទី១៣-១៦ ខែធ្នូ ឆ្នាំ២០២៤។
160,"The purpose of this business matching event is to: 1- Facilitate producers and traders in finding business partners 2- Find and expand the market for local producers and traders and 3-disseminating and promoting the export of Cambodian products to international markets, providing opportunities for Cambodian traders, artisans and producers to meet directly with distributors, buyers and consumers.",ជំនួបពាណិជ្ជកម្មនេះ ត្រូវបានរៀបចំឡើងក្នុងគោលបំណង៖ ១-ជួយសម្របសម្រួលដល់ផលិតករ និងពាណិជ្ជករក្នុងការស្វែងរកដៃគូពាណិជ្ជកម្ម ២-ស្វែងរក និងពង្រីកទីផ្សារ ជូនផលិតករ និងពាណិជ្ជករក្នុងស្រុក និង៣-ផ្សព្វផ្សាយ និងជំរុញការនាំចេញផលិតផលខ្មែរទៅកាន់ទីផ្សារអន្តរជាតិ ដែលផ្តល់ឱកាសជូន អាជីវករ សិប្បករ និងផលិតករខ្មែរ ក្នុងការជួបពិភាក្សារផ្ទាល់ជាមួយ អ្នកចែកចាយ អ្នកទទួលទិញ និងអ្នកប្រើប្រាស់។
161,"in the above business matching, there was also the sharing of experiences from speakers from the Ministry of Commerce and Cambodian companies focusing on the development of potential Cambodian products, accompanied by an exhibition of a variety of Cambodian products, including rice, cashew, mango, pepper, banana, Pailin Longan, cassava, honey, salt, coconut and a variety of products.",ក្នុងឱកាសនោះ ក៏មានការចែករំលែកបទពិសោធពីវាគ្មិន ពីក្រសួងពាណិជ្ជកម្ម និងក្រុមហ៊ុនកម្ពុជា ផ្តោតទៅលើការអភិវឌ្ឍផលិតផលសក្តានុពលខ្មែរ អមដោយការតាំងបង្ហាញផលិតផលកម្ពុជាជាច្រើនមុខ រួមមាន អង្ករ ស្វាយចន្ទី ម្រេច ស្វាយ ចេកអំបូងលឿង មៀនប៉ៃលិន ដំឡូងមី ទឹកឃ្មុំ អំបិល ដូង និងផលិតផលចម្រុះជាច្រើនមុខ។
162,"(Ankara, Türkiye): On Thursday, 12 December 2024, at the Ankara Chamber of Industry headquarters in Ankara, Mr. Keo Buntheng, Commercial Attaché to the Republic of Türkiye, coordinated the organization of the Cambodia-Turkey Business Forum, co-organized by the Cambodian Chamber of Commerce, the Ankara Chamber of Industry, and the Turkish Foreign Economic Relations Board (DEİK).","(អង់ការ៉ា, តួកគីយ៉េ)៖ នាថ្ងៃព្រហស្បតិ៍ ទី១២ ខែធ្នូ ឆ្នាំ២០២៤ នៅទីស្នាក់ការសភាឧស្សាហកម្មអង់ការ៉ា (Ankara Chamber of Industry) ទីក្រុងអង់ការ៉ា សាធារណរដ្ឋតួកគីយ៉េ លោក កែវ ប៊ុនថេង អនុព័ន្ធពាណិជ្ជកម្ម ប្រចាំសាធារណរដ្ឋតួកគីយ៉េ បានសម្របសម្រួលរៀបចំនូវវេទិកាធុរកិច្ចកម្ពុជា-តួកគីយ៉េ ដែលសហការរៀបចំដោយសភាពាណិជ្ជកម្មកម្ពុជា សភាពាណិជ្ជឧស្សាហកម្ម និងគណៈកម្មាធិការទំនាក់ទំនងសេដ្ឋកិច្ចបរទេសតួកគីយ៉េ (DEiK)។"
163,"The forum was attended by Oknha KUOCH Pheng, Vice President of the Cambodian Chamber of Commerce; representatives of Oknha KITH Meng, President of the Cambodian Chamber of Commerce and Chairman of the ASEAN Business Advisory Council for Cambodia; and representatives of 18 Turkish companies and 6 Cambodian companies.",វេទិកានេះ មានការអញ្ជើញចូលរួមពី ឧកញ៉ា គួច ផេង អនុប្រធានសភាពាណិជ្ជកម្មកម្ពុជា តំណាង អ្នកឧកញ៉ា គិត ម៉េង ប្រធានសភាពាណិជ្ជកម្មកម្ពុជា និងជាប្រធានក្រុមប្រឹក្សាពិគ្រោះយោបល់ធុរកិច្ចអាស៊ានសម្រាប់កម្ពុជា ព្រមទាំងតំណាងក្រុមហ៊ុនតួកគីយ៉េ ចំនួន១៨ និងក្រុមហ៊ុនកម្ពុជា ចំនួន៦ ផងដែរ។
164,The business forum aimed to share information about the potential for trade and investment between the two countries and to provide Cambodian and Turkish businesspeople with opportunities to explore investment partnerships and collaborations.,វេទិកាធុរកិច្ចកម្ពុជា-តួកគីយ៉េ ត្រូវបានរៀបចំឡើងដើម្បីចែករំលែកព័ត៌មានអំពីសក្តានុពលនៃពាណិជ្ជកម្មនិងការវិនិយោគរបស់ប្រទេសទាំងពីរ និងផ្តល់ឱកាសដល់ធុរជនកម្ពុជានិងតួកគីយ៉េ ស្វែងរកឱកាសក្នុងការចាប់ដៃគូរវិនិយោគនិងធ្វើធុរកិច្ចរួមគ្នា។
165,"Also at the forum, the Cambodian Chamber of Commerce and the Ankara Chamber of Industry signed a memorandum of understanding to strengthen cooperation in promoting trade and investment. In addition, the Cambodian Chamber of Commerce delegation and the Commercial Attaché visited Ankara's 1st Organized Industrial Zone to study the operations of four factories: a furniture factory, an excavator assembly factory, a frozen food factory, and a model human resource training center.",ក្នុងឱកាសនោះ សភាពាណិជ្ជកម្មកម្ពុជា និងសភាឧស្សាហកម្មអង់ការ៉ា បានចុះនូវអនុស្សរណៈនៃការយោគយល់គ្នា ដើម្បីពង្រឹងនូវកិច្ចសហប្រតិបត្តិការរវាងស្ថាប័នទាំងពីរក្នុងការជំរុញពាណិជ្ជកម្មនិងការវិនិយោគ។ ជាងនេះទៅទៀត គណៈប្រតិភូសភាពាណិជ្ជកម្មកម្ពុជា និងលោកអនុព័ន្ធពាណិជ្ជកម្ម បានធ្វើទស្សនកិច្ចទៅកាន់តំបន់ឧស្សាហកម្មទី១ ទីក្រុងអង់ការ៉ា ដើម្បីសិក្សាស្វែងយល់អំពីដំណើរការរោងចក្រចំនួន៤ រួមមាន៖ រោងចក្រផលិតគ្រឿងសង្ហារឹម រោងចក្រតំឡើង Excavator រោងចក្រផលិតចំណីអាហារបង្កក និងមជ្ឈមណ្ឌលគំរូសម្រាប់បណ្តុះបណ្តាលធនធានមនុស្ស។
166,"(Jakarta, Indonesia): On the morning of Thursday, 12 December 2024, in Jakarta, Indonesia, Mr. KANN Viseth, Economic Attaché (AEC), accompanied His Excellency HENG Sarith, Ambassador/Permanent Representative of Cambodia to ASEAN, attended the 12th Meeting of the Committee of Permanent Representatives to ASEAN (CPR) at the ASEAN Secretariat. This meeting, chaired by His Excellency Bovonethat Douangchak, Ambassador of Permanent Representative of Lao PDR to ASEAN, continued discussions on key initiatives such as ASEAN Community building, External Relations (ASEAN-Australia & ASEAN-New Zealand Dialogue Relations), and reinforced ASEAN's collective efforts for the year ahead.","(ហ្សាការតា, ឥណ្ឌូណេស៊ី)៖ នាព្រឹកថ្ងៃព្រហស្បតិ៍ ទី១២ ខែធ្នូ ឆ្នាំ២០២៤ នៅលេខាធិការដ្ឋានអាស៊ាន ក្នុងទីក្រុងហ្សាការតា ប្រទេសឥណ្ឌូណេស៊ី លោក កាន់ វិសិដ្ឋ អនុព័ន្ធទទួលបន្ទុកការងារសេដ្ឋកិច្ច បានអញ្ជើញចូលរួមអម ឯកឧត្តម ហេង សារិទ្ធ ឯកអគ្គរាជទូត/តំណាងអចិន្រ្តៃយ៍កម្ពុជាប្រចាំអាស៊ាន ចូលរួមកិច្ចប្រជុំលើកទី១២ នៃគណៈកម្មាធិការតំណាងអចិន្រ្តៃយ៍ប្រចាំអាស៊ាន (CPR) ដែលដឹកនាំដោយ ឯកឧត្តម Bovonethat Douangchak ឯកអគ្គរដ្ឋទូតស្ថានបេសកកម្មឡាវប្រចាំអាស៊ាន ដើម្បីបន្តពិភាក្សាលើគំនិតផ្តួចផ្តើមជាគន្លឹះ ដូចជាការកសាងសហគមន៍អាស៊ាន ជាមួយដៃគូសន្ទនាខាងក្រៅ (ដៃគូសន្ទនាអាស៊ាន-អូស្រ្តាលី និងដៃគូសន្ទនាអាស៊ាន-ណូវែលហ្សឺឡង់) និងការពង្រឹងកិច្ចខិតខំប្រឹងប្រែងរួមរបស់អាស៊ានសម្រាប់ឆ្នាំខាងមុខ។"
167,"This was the final meeting of 2024 of the CPR, and it preceded the CPR Chairmanship Handover Ceremony from Lao PDR to Malaysia. Malaysia will officially assume the role of ASEAN Chair starting on 1 January 2025.",សូមបញ្ជាក់ថា កិច្ចប្រជុំនេះ ជាកិច្ចប្រជុំចុងក្រោយសម្រាប់ឆ្នាំ២០២៤ និងមានពិធីផ្ទេរតំណែងជាប្រធានសម្រាប់កិច្ចប្រជុំ ពីប្រទេសឡាវជូនប្រទេសម៉ាឡេស៊ី ដែលនឹងត្រូវចូលកាន់តំណែង ជាផ្លូវការចាប់ពីថ្ងៃទី១ ខែមករា ឆ្នាំ២០២៥ ខាងមុខនេះ។
