ID,English_Text,Khmer_Text
185,"In addition, the event hosted a panel discussion with speakers from the government, international organizations, and private companies, covering critical topics such as Digital Trade, Digital Government, Artificial Intelligence (AI), Consumer Protection, Cambodia E-Commerce Trust Marks Scheme (CETS), data protection and privacy, and other related topics, as well as a Youth Debate on the future of AI in Digital Trade in Cambodia and an online expo that displays a wide range of products made in Cambodia through a digital platform on CambodiaTrade.com.","នៅក្នុងវេទិកា ក៏មានរៀបចំនូវកិច្ចពិភាក្សា ដែលមានវាគ្មិនចូលរួមពីតំណាងរដ្ឋាភិបាល អង្គការអន្តរជាតិ និងក្រុមហ៊ុនល្បីៗ លើប្រធានបទសំខាន់ៗដូចជា ពាណិជ្ជកម្មឌីជីថល, រាជរដ្ឋាភិបាលឌីជីថល, បញ្ញាសិប្បនិម្មិត, កិច្ចការពារអ្នកប្រើប្រាស់ និងសញ្ញាសម្គាល់ការជឿទុកចិត្តសម្រាប់ពាណិជ្ជកម្មអេឡិចត្រូនិកកម្ពុជា, ការការពារទិន្នន័យនិងឯកជនភាព និងប្រធានបទពាក់ព័ន្ធសំខាន់ៗមួយចំនួនទៀត ព្រមទាំងកិច្ចពិភាក្សារបស់យុវជនអំពីអនាគតនៃ AI ក្នុងពាណិជ្ជកម្មឌីជីថល នៅកម្ពុជា និងការរៀបចំពិព័រណ៍អនឡាញតាំងបង្ហាញនូវផលិតផលខ្មែរជាច្រើន តាមរយៈថ្នាលបច្ចេកវិទ្យាឌីជីថល CambodiaTrade.com ផងដែរ។"
186,"(Phnom Penh): On the afternoon of Wednesday, 11 December 2024, at the Ministry of Commerce, His Excellency BUON Sarakmony, Secretary of State of the Ministry of Commerce and high representative of Her Excellency CHAM Nimul, Minister of Commerce, received a courtesy call from the representative of the Cambodian Chamber of Commerce in California, USA, and representatives from 15 US companies, including Plug and Play, Napa Global Trade, GuestOS, CK One Marketing, Inc., Bioport Korea, Inc., PT. Primo Solusi Indo Raya, Michael Associate and Consulting, Jasmine Couture, JHC Food Industries SDN BHD, California State University, Fullerton (CSUF), Water Buffalo Pictures (WBP), Funan Trading Company (FTC), MK Express, Youlaboun INC, and King Dynasty Investment Co., Ltd.","(ភ្នំពេញ)៖ នារសៀលថ្ងៃពុធ ទី១១ ខែធ្នូ ឆ្នាំ២០២៤ នៅទីស្ដីការក្រសួងពាណិជ្ជកម្ម ឯកឧត្តម បួន សារៈមុនី រដ្ឋលេខាធិការក្រសួងពាណិជ្ជកម្ម តំណាងដ៏ខ្ពង់ខ្ពស់លោកជំទាវ ចម និម្មល រដ្ឋមន្ដ្រីក្រសួងពាណិជ្ជកម្ម បានទទួលចូលជួបសម្ដែងការគួរសម និងពិភាក្សាការងារជាមួយការិយាល័យតំណាងសភាពាណិជ្ជកម្មកម្ពុជាប្រចាំរដ្ឋកាលីហ្វ័រញ៉ា សហរដ្ឋអាម៉េរិក និងតំណាងក្រុមហ៊ុនសហដ្ឋអាម៉េរិកចំនួន១៥ រួមមាន៖ ក្រុមហ៊ុន Plug and Play, ក្រុមហ៊ុន Napa Global Trade, ក្រុមហ៊ុន GuestOS, ក្រុមហ៊ុន CK One Marketing, Inc., ក្រុមហ៊ុន Bioport Korea, Inc., ក្រុមហ៊ុន PT. Primo Solusi Indo Raya, ក្រុមហ៊ុន Michael Associate and Consulting, ក្រុមហ៊ុន Jasmine Couture, ក្រុមហ៊ុន JHC Food Industries SDN BHD, ក្រុមហ៊ុន California State University, Fullerton (CSUF), ក្រុមហ៊ុន Water Buffalo Pictures (WBP), ក្រុមហ៊ុន Funan Trading Company (FTC), ក្រុមហ៊ុន MK Express., ក្រុមហ៊ុន Youlaboun INC, និងក្រុមហ៊ុន King Dynasty Investment Co.,Ltd។"
187,"On that occasion, the representative of the Cambodian Chamber of Commerce in California, USA, informed His Excellency of the companies' purposes and progress, aiming to promote local goods consumption and export to the US market.",ក្នុងឱកាសនោះ ភាគីតំណាងសភាពាណិជ្ជកម្មកម្ពុជាប្រចាំរដ្ឋកាលីហ្វ័រញ៉ា សហរដ្ឋអាម៉េរិក បានជម្រាបជូនពីគោលបំណង និងវឌ្ឍនភាពក្រុមហ៊ុនដែលចង់មកវិនិយោគនៅប្រទេសកម្ពុជា ក្នុងគោលបំណងលើកកម្ពស់ការប្រើប្រាស់ផលិតផលក្នុងស្រុក និងជំរុញការនាំចេញផលិតផលទៅកាន់ទីផ្សារនៅសហរដ្ឋអាម៉េរិក ផងដែរ។
188,"(Jakarta, Indonesia): On the morning of Wednesday, 11 December 2024, at the Royal Embassy of Cambodia in the Republic of Indonesia, Mr. REM Nhanh, Commercial Attaché to the Royal Embassy of Cambodia, received a courtesy call from Mr. Alexander Masaltsev, Trade Representative of the Russian Federation in the Republic of Indonesia, and Mr. Nikita Iurchikov, Senior Expert, to discuss trade and economic affairs between Cambodia and the Russian Federation.","(ហ្សាការតា, ឥណ្ឌូណេស៊ី)៖ នាព្រឹកថ្ងៃពុធ ទី១១ ខែធ្នូ ឆ្នាំ២០២៤ នៅស្ថានអគ្គរាជទូតកម្ពុជាប្រចាំនៅសាធារណរដ្ឋឥណ្ឌូណេស៊ី លោក រ៉េម ញ៉ាញ់ អនុព័ន្ធពាណិជ្ជកម្មប្រចាំសាធារណរដ្ឋឥណ្ឌូណេស៊ី បានជួបពិភាក្សាការងារជាមួយ លោក Alexander Masaltsev តំណាងពាណិជ្ជកម្មសហព័ន្ធរុស្ស៊ីប្រចាំសាធារណរដ្ឋឥណ្ឌូណេស៊ី និង លោក Nikita Iurchikov ប្រធានការិយាល័យជំនាញពាណិជ្ជកម្មហសព័ន្ធរុស្ស៊ី ប្រចាំនៅសាធារណរដ្ឋឥណ្ឌូណេស៊ី ដើម្បីពិភាក្សាអំពីកិច្ចការពាណិជ្ជកម្ម និងសេដ្ឋកិច្ចរវាងប្រទេសកម្ពុជា និងសហព័ន្ធរុស្ស៊ី។"
189,"On that occasion, Mr. Rem Nhanh addressed the volume of trade, exports, imports, and potential goods between the two countries, and Cambodia's potential goods.",នៅក្នុងឱកាសនោះ លោកអនុព័ន្ធពាណិជ្ជកម្ម បានលើកឡើងអំពីទំហំពាណិជ្ជកម្ម ការនាំចេញ-នាំចូល មុខទំនិញដែលមានសក្តានុពលរវាងប្រទេសទាំងពីរ និងទំនិញដែលមានសក្តានុពលរបស់ប្រទេសកម្ពុជា។
190,"Mr. Alexander Masaltsev expressed his pleasure at the meeting and by seeking the positive trade relations between the two countries, He stated his intention to open a trade representative office at the Embassy of the Russian Federation in Cambodia in the future.",ជាមួយគ្នានេះ លោក Alexander Masaltsev បានបង្ហាញនូវសេចក្តីសោមនស្សរីករាយចំពោះកិច្ចពិភាក្សានេះ ហើយ លោក បញ្ជាក់ផងដែរថា ដោយមើលឃើញពីភាពវិជ្ជមាននៃទំហំពាណិជ្ជកម្មរវាងប្រទេសទាំងពីរ លោកមានបំណងចង់ឱ្យមានការិយាល័យតំណាងពាណិជ្ជកម្មរុស្ស៊ី នៅស្ថានអគ្គរាជទូតសហព័ន្ធរុស្ស៊ីប្រចាំនៅប្រទេសកម្ពុជានាពេលខាងមុខ ផងដែរ។
191,"(Phnom Penh): On the Morning of Wednesday, 10 December 2024, at Hyatt Regency PhnomPenh, Her Excellency TAN Tepikanika, Under Secretary of State of the Ministry of Commerce, attended the Capacity Building for Piloting the ASEAN Handbook on Good Regulatory Practice-GRP on Electric Vehicle and Battery Industry in Cambodia which cooperated with Economic Research Institute for ASEAN and East Asia (ERIA).",(ភ្នំពេញ)៖ នាព្រឹកថ្ងៃពុធ ទី១១ ខែធ្នូ ឆ្នាំ២០២៤ នៅសណ្ឋាគា ហៃយ៉ាត់ រីជិនស៊ី ភ្នំពេញ លោកជំទាវ តាន់ ទេពីកណ្ណិកា អនុរដ្ឋលេខាធិការក្រសួងពាណិជ្ជកម្ម បានអញ្ជើញចូលរួមក្នុងកម្មវិធីបណ្ដុះបណ្តាលស្ដីអំពី “សៀវភៅរបស់អាស៊ានស្ដីពីការប្រតិបត្តិល្អនៃបទប្បញ្ញត្តិ ដោយសាកល្បងលើវិស័យរថយន្តអគ្គិសនី និងឧស្សាហកម្មអាគុយ” ដែលសហការជាមួយនឹងវិទ្យាស្ថានស្រាវជ្រាវសេដ្ឋកិច្ចអាស៊ាន និងអាស៊ីបូព៌ា។
192,"( Jakarta, Indonesia): On the afternoon of Monday, 9 December 2024, in Jakarta, Indonesia, Mr. KANN Viseth, Economic Attaché (AEC), accompanied His Excellency HENG Sarith, Ambassador/Permanent Representative of Cambodia to ASEAN, participated in the Inauguration of the RCEP Support Unit (RSU) Office, presided over by His Excellency Dr. KAO Kim Hourn, Secretary-General of ASEAN and His Excellency Dr. Budi Santoso, Minister of Trade of the Republic of Indonesia at ASEAN Secretariat.","(ហ្សាការតា, ឥណ្ឌូណេស៊ី)៖ នារសៀលថ្ងៃចន្ទ ទី៩ ខែធ្នូ ឆ្នាំ២០២៤ នៅទីក្រុងហ្សាការតា ប្រទេសឥណ្ឌូណេស៊ី លោក កាន់ វិសិដ្ឋ អនុព័ន្ធទទួលបន្ទុកការងារសេដ្ឋកិច្ច ចូលរួមអម ឯកឧត្តម ហេង សារិទ្ធ ឯកអគ្គរាជទូត/តំណាងអចិន្ត្រៃយ៍កម្ពុជាប្រចាំអាស៊ាន បានអញ្ជើញចូលរួមកម្មវិធីសម្ពោធការិយាល័យអង្គភាពគាំទ្រអាសិប (RSU Office) ក្រោមអធិតីភាព ឯកឧត្តម កៅ គឹមហួន អគ្គលេខាធិការអាស៊ាន និង ឯកឧត្តមបណ្ឌិត Budi Santoso រដ្ឋមន្រ្តីពាណិជ្ជកម្មឥណ្ឌូណេស៊ី នៅលេខាធិការដ្នានអាស៊ាន។"
193,This an official inauguration has participated by Ambassadors/Permanent Mission of ASEAN Member States to ASEAN and Ambassadors of ASEAN-RCEP as well as ASEAN Secretariat’s officers.,ពិធីសម្ពោធនេះ មានការអញ្ជើញចូលរួមពីសំណាក់ ឯកអគ្គរាជទូត/រដ្ឋទូត នៃស្ថានបេសកកម្មប្រទេសអាស៊ានប្រចាំទីក្រុងហ្សាការតា ឯកអគ្គរដ្ឋទូត នៃដៃគូអាស៊ានអាសិប និងមន្រ្តីតំណាងស្ថានបេសកកម្មអាស៊ាន ព្រមទាំងមន្រ្តីលេខាធិការអាស៊ានផងដែរ។
194,"This significant milestone marks the full operationalisation of the RSU, which will provide the necessary institutional support to the RCEP Joint Committee (RJC) and its subsidiary bodies, ensuring a more effective implementation of the RCEP agreement and fostering deeper regional cooperation.",ព្រឹត្តិការណ៍ដ៏សំខាន់នេះ បានបង្ហាញពីប្រតិបត្តិការពេញលេញនៃការិយាល័យអង្គភាពគាំទ្រអាសិប ដែលនឹងផ្តល់ការគាំទ្រចាំបាច់ដល់គណៈកម្មាធិការរួមអាសិប និងគាំទ្រដំណើរការរបស់ស្ថាប័ន ដោយធានាបាននូវការអនុវត្តកិច្ចព្រមព្រៀងអាសិប ព្រមទាំងជួយជំរុញកិច្ចសហប្រតិបត្តិការ ក្នុងតំបន់ឱ្យកាន់តែស៊ីជម្រៅ។
195,"(Phnom Penh): On the morning of Tuesday, 10 December 2024, His Excellency TAT Puthsodary, Secretary of State of the Ministry of Commerce, presided over the opening ceremony of a consultation workshop on “The Assessment and Roadmap Development for Green Trade Standards, Rules of Origin, and Double Transformation” co-organized by the Trade Training and Research Institute (TTRI) with the United Nations Development Programme (UNDP).",(ភ្នំពេញ)៖ នាព្រឹកថ្ងៃអង្គារ ទី១០ ខែធ្នូ ឆ្នាំ២០២៤ ឯកឧត្ដម តាត ពុធសូដារី រដ្ឋលេខាធិការក្រសួងពាណិជ្ជកម្ម បានអញ្ជើញជាអធិបតីក្នុងពិធីបើកសិក្ខាសាលាពិគ្រោះយោបល់ ស្តីពី “ការវាយតម្លៃ និងការអភិវឌ្ឍផែនទីបង្ហាញផ្លូវសម្រាប់ស្តង់ដាពាណិជ្ជកម្មបៃតង វិធានដើមកំណើតទំនិញ និងបរិវត្តកម្មទ្វេដង” ដែលសហការរៀបចំដោយវិទ្យាស្ថានបណ្ដុះបណ្ដាលពាណិជ្ជកម្ម និងស្រាវជ្រាវ ជាមួយកម្មវិធីអភិវឌ្ឍន៍សហប្រជាជាតិប្រចាំកម្ពុជា (UNDP)។
196,"There are 53 participants from relevant ministries, the private sector, and development partners, and the aim is to gather inputs from experts to build a roadmap for Cambodia to promote the implementation of sustainable green trade standards and EU rules of origin in order to boost Cambodia’s exports to the EU market, especially after Cambodia’s LDC graduation in 2029.",សិក្ខាសាលានេះ មានសិក្ខាកាមចូលរួមសរុបចំនួន ៥៣នាក់ មកពីក្រសួងពាក់ព័ន្ធ វិស័យឯកជន និងដៃគូអភិវឌ្ឍន៍ និងរៀបចំឡើងក្នុងគោលបំណងប្រមូលធាតុចូលពីអ្នកជំនាញ ដើម្បីរៀបចំការអភិវឌ្ឍផែនទីបង្ហាញផ្លូវសម្រាប់កម្ពុជាក្នុងការលើកកម្ពស់ការអនុវត្តស្តង់ដាពាណិជ្ជកម្មបៃតងប្រកបដោយចីរភាព និងវិធានដើមកំណើតទំនិញរបស់សហភាពអឺរ៉ុប ក្នុងការជំរុញការនាំចេញទំនិញពីកម្ពុជាទៅកាន់ទីផ្សារសហភាពអឺរ៉ុប ជាពិសេសគឺក្រោយពេលដែលកម្ពុជាចាកចេញពីប្រទេសអភិវឌ្ឍន៍តិចតួចនៅឆ្នាំ ២០២៩៕
197,"(Seoul, Korea): On Tuesday, 10 December 2024, Ms. NUON Phanith, Commercial Attaché to the Royal Embassy of the Kingdom of Cambodia to the Republic of Korea, attended a Trade and Investment Working Group meeting organized by the Trade and Investment Unit (TIU) at the ASEAN-Korea Centre (AKC).","(សេអ៊ូល, កូរ៉េ)៖ នាថ្ងៃអង្គារ ទី១០ ខែធ្នូ ឆ្នាំ២០២៤ លោកស្រី នួន ផានិត អនុព័ន្ធពាណិជ្ជកម្ម ប្រចាំសាធារណរដ្ឋកូរ៉េ បានចូលរួមកិច្ចប្រជុំក្រុមការងារពាណិជ្ជកម្ម និងវិនិយោគ ដែលរៀបចំដោយអង្គភាពផ្នែកពាណិជ្ជកម្ម និងវិនិយោគ នៅមជ្ឈមណ្ឌលអាស៊ាន-កូរ៉េ ។"
198,"On that occasion, the meeting exchanged views and discussed the 2024 outcomes, the plan for the 12th Connectivity Forum: ASEAN-Korea Centre (AKC) review of the ASEAN Connectivity project over the past 15 years, and directions for future Korea-ASEAN connectivity cooperation and strategy planning sessions, as well as priority 2025 programs among ASEAN countries.","ក្នុងឱកាសនោះ អង្គប្រជុំបានផ្លាស់ប្តូរយោបល់ ពិភាក្សា និងលើកឡើងអំពីសមិទ្ធិផលនៃការអនុវត្តសកម្មភាពឆ្នាំ២០២៤ នាពេលកន្លងមក, អំពីផែនការវេទិកាតភ្ជាប់លើកទី១២៖ ពិនិត្យឡើងវិញនូវសកម្មភាពរបស់មជ្ឈមណ្ឌលអាស៊ាន-កូរ៉េ លើគម្រោងតភ្ជាប់ជាមួយបណ្តាប្រទេសអាស៊ានក្នុងរយៈពេល ១៥ឆ្នាំកន្លងមក និងពិភាក្សាទិសដៅ ដែលប្រទេសកូរ៉េ និងប្រទេសអាស៊ានគួរតែសហការសម្រាប់កិច្ចសហប្រតិបត្តិការតភ្ជាប់វិស័យពាណិជ្ជកម្មនាពេលអនាគត ព្រមទាំងការរៀបចំផែនការយុទ្ធសាស្ត្រ និងការងារអាទិភាពប្រចាំឆ្នាំ២០២៥ របស់សហគមន៍សេដ្ឋកិច្ចអាស៊ាន។"
199,"(Phnom Penh): On the afternoon of Tuesday, 10 December 2024, at the Ministry of Commerce, His Excellency BUON Sarakmony, Secretary of State of the Ministry of Commerce and high representative of Her Excellency CHAM Nimul, Minister of Commerce, received a courtesy call from representatives of Cambodia Beverage Company Limited (Coca-Cola), the leading manufacturer and distributor of non-alcoholic beverages in Cambodia.",(ភ្នំពេញ)៖ នារសៀលថ្ងៃអង្គារ ទី១០ ខែធ្នូ ឆ្នាំ២០២៤ នៅទីស្ដីការក្រសួងពាណិជ្ជកម្ម ឯកឧត្តម បួន សារៈមុនី រដ្ឋលេខាធិការក្រសួងពាណិជ្ជកម្ម តំណាងដ៏ខ្ពង់ខ្ពស់លោកជំទាវ ចម និម្មល រដ្ឋមន្ដ្រីក្រសួងពាណិជ្ជកម្ម បានទទួលជួបសម្ដែងការគួរសម និងពិភាក្សាការងារជាមួយតំណាងក្រុមហ៊ុន Cambodia Beverage Company Limited (កូកា-កូឡា) ដែលជាក្រុមហ៊ុនផលិតនិងចែកចាយភេសជ្ជៈគ្មានជាតិស្រវឹងឈានមុខគេនៅកម្ពុជា។
200,"On that occasion, the representatives of Cambodia Beverage Company Limited (Coca-Cola) briefed on the company’s investment progress in Cambodia, promotion the consumption of local products, and introduced the new CEO, Mr. Paulo Gaspar Rodrigues, who has been assigned to hand over from the current CEO.",ក្នុងឱកាសនោះ ភាគីតំណាងក្រុមហ៊ុន Cambodia Beverage Company Limited (កូកា-កូឡា) ជម្រាបជូនអំពីវឌ្ឍនភាពនៃការវិនិយោគរបស់ក្រុមហ៊ុនកូកាកូឡានៅកម្ពុជា ការលើកកម្ពស់ការប្រើប្រាស់ផលិតផលក្នុងស្រុក និងបានណែនាំបេក្ខភាពអនាគតនាយកប្រតិបត្តិថ្មី គឺ លោក Paulo Gaspar Rodrigues ដែលត្រូវបានចាត់តាំងឱ្យមកបន្តវេនការងារ ពីលោកនាយកប្រតិបត្តិបច្ចុប្បន្ន។
201,"Her Excellency Cham Nimul, Minister of Commerce, presided over the signing ceremony of a Memorandum of Understanding (MoU) on “Cooperation on the Promotion of Cambodian Cashew Products Consumption” between Cambodia Hotel Association and Cambodia Cashew Federation and Cambodia Cashew Association.",
202,"(Phnom Penh): On the morning of Tuesday, 10 December 2024, at the Ministry of Commerce, Her Excellency CHAM Nimul, Minister of Commerce, presided over the signing ceremony of a Memorandum of Understanding on “Cooperation on the Promotion of Cambodian Cashew Products Consumption.” The ceremony was attended by leaders and officials from the Ministry of Commerce, executives from Cambodia Hotel Association, Cambodia Cashew Federation, the Cashew nut Association of Cambodia, supermarkets, marts and cashew enterprises. The primary goal of this cooperation is to promote the use of cashew products in the hospitality sector, enhancing the processing, utilization, and distribution of Cambodian cashew products.",(ភ្នំពេញ)៖ នាព្រឹកថ្ងៃអង្គារ ទី១០ ខែធ្នូ ឆ្នាំ២០២៤ នៅទីស្តីការក្រសួងពាណិជ្ជកម្ម លោកជំទាវ ចម និម្មល រដ្ឋមន្រ្តីក្រសួងពាណិជ្ជកម្ម បានអញ្ជើញជាអធិបតីក្នុងពិធីចុះហត្ថលេខាលើអនុស្សរណៈនៃការយោគយល់គ្នាស្តីពី “កិច្ចសហប្រតិបត្តិការជំរុញការប្រើប្រាស់ផលិតផលស្វាយចន្ទីកម្ពុជា” ដែលមានការអញ្ជើញចូលរួមពីថ្នាក់ដឹកនាំ និងមន្ត្រីពាក់ព័ន្ធរបស់ក្រសួងពាណិជ្ជកម្ម ថ្នាក់ដឹកនាំសមាគមសណ្ឋាគារកម្ពុជា សមាគមសហព័ន្ធស្វាយចន្ទីកម្ពុជា សមាគមស្វាយចន្ទីកម្ពុជា ផ្សារទំនើប ម៉ាត និងសហគ្រាសស្វាយចន្ទីជាច្រើនរូប ក្នុងគោលបំណងជំរុញការប្រើប្រាស់ផលិតផលស្វាយចន្ទីក្នុងវិស័យសណ្ឋាគារ ដើម្បីលើកកម្ពស់ការកែច្នៃ ការប្រើប្រាស់ និងការចែកចាយផលិតផលស្វាយចន្ទីនៅកម្ពុជា។
